{
  "$schema": "../component.schema.json",
  "schemaVersion": "1.0.0",
  "id": "progress",
  "title": "Progress",
  "description": "Determinate progress indicator.",
  "category": "feedback",
  "maturity": "beta",
  "searchTerms": [
    "progress",
    "completion",
    "loading",
    "react",
    "blade"
  ],
  "react": {
    "files": [
      "react/components/ui/progress.tsx"
    ],
    "exports": [
      "Progress"
    ],
    "props": [
      {
        "name": "value",
        "type": "number | null",
        "required": false,
        "default": null
      },
      {
        "name": "max",
        "type": "number",
        "required": false,
        "default": 100
      },
      {
        "name": "className",
        "type": "string",
        "required": false,
        "description": "Additional consumer layout or spacing classes."
      }
    ],
    "internalDependencies": [],
    "npmDependencies": [
      {
        "name": "@radix-ui/react-progress",
        "version": "1.1.2",
        "purpose": "Direct component import"
      }
    ],
    "exampleFiles": [
      "react/examples/progress/basic.tsx"
    ]
  },
  "blade": {
    "files": [
      "blade/library/resources/views/components/ui/progress.blade.php"
    ],
    "canonicalTag": "<x-ui.progress>",
    "legacyTags": [],
    "props": [
      {
        "name": "value",
        "type": "float",
        "required": false,
        "default": 0
      },
      {
        "name": "max",
        "type": "float",
        "required": false,
        "default": 100
      },
      {
        "name": "label",
        "type": "string | null",
        "required": false,
        "default": null
      }
    ],
    "slots": [
      "default"
    ],
    "events": [],
    "phpDependencies": [],
    "runtimeDependencies": [],
    "installTargets": [
      "app/View/Components/Ui",
      "resources/views/components/ui",
      "resources/js/ui",
      "resources/css"
    ],
    "exampleFiles": [
      "blade/examples/progress/basic.blade.php"
    ]
  },
  "shared": {
    "variants": [
      {
        "name": "default",
        "default": true
      }
    ],
    "sizes": [],
    "states": [
      "default",
      "disabled",
      "focus-visible"
    ],
    "responsiveBehavior": [
      "Retains touch targets and usable wrapping at 360px."
    ],
    "tokens": [
      "--background",
      "--foreground",
      "--primary",
      "--primary-foreground",
      "--muted",
      "--muted-foreground",
      "--border",
      "--input",
      "--ring",
      "--radius"
    ],
    "iconMappings": []
  },
  "previews": [
    {
      "id": "basic",
      "title": "Basic",
      "reactExample": "react/examples/progress/basic.tsx",
      "bladeExample": "blade/examples/progress/basic.blade.php",
      "states": [
        "default",
        "disabled",
        "focus-visible"
      ],
      "supportsDirection": false
    }
  ],
  "parity": {
    "classification": "framework-equivalent",
    "intentionalDifferences": []
  },
  "accessibility": {
    "wcagTarget": "WCAG 2.2 AA",
    "auditStatus": "passed",
    "findings": []
  },
  "source": {
    "commit": "d1511e224305585680723101a0b76be93eb9f2f0",
    "verifiedAt": "2026-07-28",
    "files": [
      {
        "path": "src/app/components/ui/progress.tsx",
        "sha256": "956cf4b485bcf57684caac10df2aa2a72387d0736d8f4cd1315c49ebd2da4615"
      }
    ],
    "decisionReferences": [
      "provenance/decisions.md#component-scope"
    ]
  }
}
