{
  "$schema": "../component.schema.json",
  "schemaVersion": "1.0.0",
  "id": "switch",
  "title": "Switch",
  "description": "Binary setting control.",
  "category": "forms",
  "maturity": "stable",
  "searchTerms": [
    "switch",
    "toggle",
    "boolean",
    "react",
    "blade"
  ],
  "react": {
    "files": [
      "react/components/ui/switch.tsx"
    ],
    "exports": [
      "Switch"
    ],
    "props": [
      {
        "name": "checked",
        "type": "boolean",
        "required": false
      },
      {
        "name": "defaultChecked",
        "type": "boolean",
        "required": false
      },
      {
        "name": "onCheckedChange",
        "type": "(checked: boolean) => void",
        "required": false
      },
      {
        "name": "disabled",
        "type": "boolean",
        "required": false,
        "default": false
      },
      {
        "name": "className",
        "type": "string",
        "required": false,
        "description": "Additional consumer layout or spacing classes."
      }
    ],
    "internalDependencies": [],
    "npmDependencies": [
      {
        "name": "@radix-ui/react-switch",
        "version": "1.1.3",
        "purpose": "Direct component import"
      }
    ],
    "exampleFiles": [
      "react/examples/switch/basic.tsx"
    ]
  },
  "blade": {
    "files": [
      "blade/library/resources/views/components/ui/switch.blade.php"
    ],
    "canonicalTag": "<x-ui.switch>",
    "legacyTags": [],
    "props": [
      {
        "name": "name",
        "type": "string",
        "required": true
      },
      {
        "name": "checked",
        "type": "bool",
        "required": false,
        "default": false
      },
      {
        "name": "value",
        "type": "string",
        "required": false,
        "default": "1"
      },
      {
        "name": "label",
        "type": "string | null",
        "required": false,
        "default": null
      },
      {
        "name": "disabled",
        "type": "bool",
        "required": false,
        "default": false
      }
    ],
    "slots": [
      "default"
    ],
    "events": [
      "ui:switch:change"
    ],
    "phpDependencies": [],
    "runtimeDependencies": [
      {
        "name": "alpinejs",
        "version": "3.15.8",
        "purpose": "Blade interaction runtime"
      }
    ],
    "installTargets": [
      "app/View/Components/Ui",
      "resources/views/components/ui",
      "resources/js/ui",
      "resources/css"
    ],
    "exampleFiles": [
      "blade/examples/switch/basic.blade.php"
    ]
  },
  "shared": {
    "variants": [
      {
        "name": "default",
        "default": true
      }
    ],
    "sizes": [],
    "states": [
      "default",
      "disabled",
      "focus-visible",
      "controlled",
      "uncontrolled",
      "checked"
    ],
    "responsiveBehavior": [
      "Retains touch targets and usable wrapping at 360px."
    ],
    "tokens": [
      "--background",
      "--foreground",
      "--primary",
      "--primary-foreground",
      "--muted",
      "--muted-foreground",
      "--border",
      "--input",
      "--ring",
      "--radius"
    ],
    "iconMappings": []
  },
  "previews": [
    {
      "id": "basic",
      "title": "Basic",
      "reactExample": "react/examples/switch/basic.tsx",
      "bladeExample": "blade/examples/switch/basic.blade.php",
      "states": [
        "default",
        "disabled",
        "focus-visible",
        "controlled",
        "uncontrolled",
        "checked"
      ],
      "supportsDirection": false
    }
  ],
  "parity": {
    "classification": "framework-equivalent",
    "intentionalDifferences": []
  },
  "accessibility": {
    "wcagTarget": "WCAG 2.2 AA",
    "auditStatus": "passed",
    "findings": []
  },
  "source": {
    "commit": "d1511e224305585680723101a0b76be93eb9f2f0",
    "verifiedAt": "2026-07-28",
    "files": [
      {
        "path": "src/app/components/ui/switch.tsx",
        "sha256": "d4c744131c6161300510909aafe2c2cb6d819f2c7a8c2aeb75d4317004c7eff7"
      }
    ],
    "decisionReferences": [
      "provenance/decisions.md#component-scope"
    ]
  }
}
