{
  "$schema": "../component.schema.json",
  "schemaVersion": "1.0.0",
  "id": "tooltip",
  "title": "Tooltip",
  "description": "Short non-essential help shown on hover or focus.",
  "category": "overlays",
  "maturity": "stable",
  "searchTerms": [
    "tooltip",
    "hint",
    "hover",
    "react",
    "blade"
  ],
  "react": {
    "files": [
      "react/components/ui/tooltip.tsx"
    ],
    "exports": [
      "Tooltip",
      "TooltipTrigger",
      "TooltipContent",
      "TooltipProvider"
    ],
    "props": [
      {
        "name": "delayDuration",
        "type": "number",
        "required": false,
        "default": 0
      },
      {
        "name": "open",
        "type": "boolean",
        "required": false
      },
      {
        "name": "onOpenChange",
        "type": "(open: boolean) => void",
        "required": false
      },
      {
        "name": "className",
        "type": "string",
        "required": false,
        "description": "Additional consumer layout or spacing classes."
      }
    ],
    "internalDependencies": [],
    "npmDependencies": [
      {
        "name": "@radix-ui/react-tooltip",
        "version": "1.1.8",
        "purpose": "Direct component import"
      }
    ],
    "exampleFiles": [
      "react/examples/tooltip/basic.tsx"
    ]
  },
  "blade": {
    "files": [
      "blade/library/resources/views/components/ui/tooltip.blade.php",
      "blade/library/resources/views/components/ui/tooltip/content.blade.php",
      "blade/library/resources/views/components/ui/tooltip/trigger.blade.php"
    ],
    "canonicalTag": "<x-ui.tooltip>",
    "legacyTags": [],
    "props": [
      {
        "name": "open",
        "type": "bool",
        "required": false,
        "default": false
      },
      {
        "name": "placement",
        "type": "string",
        "required": false,
        "default": "top"
      },
      {
        "name": "delay",
        "type": "int",
        "required": false,
        "default": 0
      }
    ],
    "slots": [
      "default",
      "trigger",
      "content"
    ],
    "events": [
      "ui:tooltip:change"
    ],
    "phpDependencies": [],
    "runtimeDependencies": [
      {
        "name": "alpinejs",
        "version": "3.15.8",
        "purpose": "Blade interaction runtime"
      },
      {
        "name": "@floating-ui/dom",
        "version": "1.7.4",
        "purpose": "Blade interaction runtime"
      }
    ],
    "installTargets": [
      "app/View/Components/Ui",
      "resources/views/components/ui",
      "resources/js/ui",
      "resources/css"
    ],
    "exampleFiles": [
      "blade/examples/tooltip/basic.blade.php"
    ]
  },
  "shared": {
    "variants": [
      {
        "name": "default",
        "default": true
      }
    ],
    "sizes": [],
    "states": [
      "default",
      "disabled",
      "focus-visible",
      "controlled",
      "uncontrolled",
      "open",
      "closed"
    ],
    "responsiveBehavior": [
      "Retains touch targets and usable wrapping at 360px.",
      "Floating or modal content is constrained to the viewport."
    ],
    "tokens": [
      "--background",
      "--foreground",
      "--primary",
      "--primary-foreground",
      "--muted",
      "--muted-foreground",
      "--border",
      "--input",
      "--ring",
      "--radius"
    ],
    "iconMappings": []
  },
  "previews": [
    {
      "id": "basic",
      "title": "Basic",
      "reactExample": "react/examples/tooltip/basic.tsx",
      "bladeExample": "blade/examples/tooltip/basic.blade.php",
      "states": [
        "default",
        "disabled",
        "focus-visible",
        "controlled",
        "uncontrolled",
        "open",
        "closed"
      ],
      "supportsDirection": true
    }
  ],
  "parity": {
    "classification": "framework-equivalent",
    "intentionalDifferences": []
  },
  "accessibility": {
    "wcagTarget": "WCAG 2.2 AA",
    "auditStatus": "passed",
    "findings": []
  },
  "source": {
    "commit": "d1511e224305585680723101a0b76be93eb9f2f0",
    "verifiedAt": "2026-07-28",
    "files": [
      {
        "path": "src/app/components/ui/tooltip.tsx",
        "sha256": "2f3a8720fb4b75c6911450be73d0407e2a84bb5ea1ded28ccdbf955be62a0155"
      }
    ],
    "decisionReferences": [
      "provenance/decisions.md#component-scope"
    ]
  }
}
