{
  "$schema": "../component.schema.json",
  "schemaVersion": "1.0.0",
  "id": "pagination",
  "title": "Pagination",
  "description": "Composable page navigation links and ellipsis.",
  "category": "navigation",
  "maturity": "beta",
  "searchTerms": [
    "pagination",
    "pages",
    "navigation",
    "react",
    "blade"
  ],
  "react": {
    "files": [
      "react/components/ui/pagination.tsx"
    ],
    "exports": [
      "Pagination",
      "PaginationContent",
      "PaginationItem",
      "PaginationLink",
      "PaginationPrevious",
      "PaginationNext",
      "PaginationEllipsis"
    ],
    "props": [
      {
        "name": "aria-label",
        "type": "string",
        "required": false,
        "default": "pagination"
      },
      {
        "name": "className",
        "type": "string",
        "required": false,
        "description": "Additional consumer layout or spacing classes."
      }
    ],
    "internalDependencies": [
      "button"
    ],
    "npmDependencies": [
      {
        "name": "lucide-react",
        "version": "0.487.0",
        "purpose": "Direct component import"
      }
    ],
    "exampleFiles": [
      "react/examples/pagination/basic.tsx"
    ]
  },
  "blade": {
    "files": [
      "blade/library/resources/views/components/ui/pagination.blade.php",
      "blade/library/resources/views/components/ui/pagination/content.blade.php",
      "blade/library/resources/views/components/ui/pagination/ellipsis.blade.php",
      "blade/library/resources/views/components/ui/pagination/item.blade.php",
      "blade/library/resources/views/components/ui/pagination/link.blade.php",
      "blade/library/resources/views/components/ui/pagination/next.blade.php",
      "blade/library/resources/views/components/ui/pagination/previous.blade.php"
    ],
    "canonicalTag": "<x-ui.pagination>",
    "legacyTags": [],
    "props": [],
    "slots": [
      "default"
    ],
    "events": [],
    "phpDependencies": [],
    "runtimeDependencies": [],
    "installTargets": [
      "app/View/Components/Ui",
      "resources/views/components/ui",
      "resources/js/ui",
      "resources/css"
    ],
    "exampleFiles": [
      "blade/examples/pagination/basic.blade.php"
    ]
  },
  "shared": {
    "variants": [
      {
        "name": "default",
        "default": true
      }
    ],
    "sizes": [],
    "states": [
      "default",
      "disabled",
      "focus-visible"
    ],
    "responsiveBehavior": [
      "Retains touch targets and usable wrapping at 360px."
    ],
    "tokens": [
      "--background",
      "--foreground",
      "--primary",
      "--primary-foreground",
      "--muted",
      "--muted-foreground",
      "--border",
      "--input",
      "--ring",
      "--radius"
    ],
    "iconMappings": [
      {
        "meaning": "previous",
        "react": "ChevronLeft",
        "blade": "caret-left",
        "size": "16px",
        "weight": "regular"
      },
      {
        "meaning": "next",
        "react": "ChevronRight",
        "blade": "caret-right",
        "size": "16px",
        "weight": "regular"
      }
    ]
  },
  "previews": [
    {
      "id": "basic",
      "title": "Basic",
      "reactExample": "react/examples/pagination/basic.tsx",
      "bladeExample": "blade/examples/pagination/basic.blade.php",
      "states": [
        "default",
        "disabled",
        "focus-visible"
      ],
      "supportsDirection": true
    }
  ],
  "parity": {
    "classification": "framework-equivalent",
    "intentionalDifferences": [
      "React uses Lucide and Blade uses Phosphor; semantic glyph, rendered size, weight, colour and alignment match while path shapes may differ."
    ]
  },
  "accessibility": {
    "wcagTarget": "WCAG 2.2 AA",
    "auditStatus": "passed",
    "findings": []
  },
  "source": {
    "commit": "d1511e224305585680723101a0b76be93eb9f2f0",
    "verifiedAt": "2026-07-28",
    "files": [
      {
        "path": "src/app/components/ui/pagination.tsx",
        "sha256": "10bad2279ea5120ade645a1a834ed74f2471cde0fe7f3e9457fcb4918b7d0bc3"
      }
    ],
    "decisionReferences": [
      "provenance/decisions.md#component-scope"
    ]
  }
}
