{
  "$schema": "../component.schema.json",
  "schemaVersion": "1.0.0",
  "id": "input-otp",
  "title": "Input OTP",
  "description": "Grouped one-time-code entry slots.",
  "category": "forms",
  "maturity": "stable",
  "searchTerms": [
    "otp",
    "verification",
    "code",
    "input otp",
    "react",
    "blade"
  ],
  "react": {
    "files": [
      "react/components/ui/input-otp.tsx"
    ],
    "exports": [
      "InputOTP",
      "InputOTPGroup",
      "InputOTPSlot",
      "InputOTPSeparator"
    ],
    "props": [
      {
        "name": "maxLength",
        "type": "number",
        "required": true
      },
      {
        "name": "value",
        "type": "string",
        "required": false
      },
      {
        "name": "onChange",
        "type": "(value: string) => void",
        "required": false
      },
      {
        "name": "className",
        "type": "string",
        "required": false,
        "description": "Additional consumer layout or spacing classes."
      }
    ],
    "internalDependencies": [],
    "npmDependencies": [
      {
        "name": "input-otp",
        "version": "1.4.2",
        "purpose": "Direct component import"
      },
      {
        "name": "lucide-react",
        "version": "0.487.0",
        "purpose": "Direct component import"
      }
    ],
    "exampleFiles": [
      "react/examples/input-otp/basic.tsx"
    ]
  },
  "blade": {
    "files": [
      "blade/library/resources/views/components/ui/input-otp.blade.php",
      "blade/library/resources/views/components/ui/input-otp/group.blade.php",
      "blade/library/resources/views/components/ui/input-otp/separator.blade.php",
      "blade/library/resources/views/components/ui/input-otp/slot.blade.php"
    ],
    "canonicalTag": "<x-ui.input-otp>",
    "legacyTags": [],
    "props": [
      {
        "name": "name",
        "type": "string",
        "required": true
      },
      {
        "name": "length",
        "type": "int",
        "required": false,
        "default": 6
      },
      {
        "name": "value",
        "type": "string",
        "required": false,
        "default": ""
      },
      {
        "name": "label",
        "type": "string",
        "required": false,
        "default": "One-time password"
      }
    ],
    "slots": [
      "default"
    ],
    "events": [
      "ui:input-otp:change"
    ],
    "phpDependencies": [],
    "runtimeDependencies": [
      {
        "name": "alpinejs",
        "version": "3.15.8",
        "purpose": "Blade interaction runtime"
      }
    ],
    "installTargets": [
      "app/View/Components/Ui",
      "resources/views/components/ui",
      "resources/js/ui",
      "resources/css"
    ],
    "exampleFiles": [
      "blade/examples/input-otp/basic.blade.php"
    ]
  },
  "shared": {
    "variants": [
      {
        "name": "default",
        "default": true
      }
    ],
    "sizes": [],
    "states": [
      "default",
      "disabled",
      "focus-visible",
      "controlled",
      "uncontrolled",
      "invalid"
    ],
    "responsiveBehavior": [
      "Retains touch targets and usable wrapping at 360px."
    ],
    "tokens": [
      "--background",
      "--foreground",
      "--primary",
      "--primary-foreground",
      "--muted",
      "--muted-foreground",
      "--border",
      "--input",
      "--ring",
      "--radius"
    ],
    "iconMappings": [
      {
        "meaning": "separator",
        "react": "Minus",
        "blade": "minus",
        "size": "16px",
        "weight": "regular"
      }
    ]
  },
  "previews": [
    {
      "id": "basic",
      "title": "Basic",
      "reactExample": "react/examples/input-otp/basic.tsx",
      "bladeExample": "blade/examples/input-otp/basic.blade.php",
      "states": [
        "default",
        "disabled",
        "focus-visible",
        "controlled",
        "uncontrolled",
        "invalid"
      ],
      "supportsDirection": false
    }
  ],
  "parity": {
    "classification": "documented-exception",
    "intentionalDifferences": [
      "The Blade edition uses a library-owned Alpine controller instead of the React input-otp package.",
      "React uses Lucide and Blade uses Phosphor; semantic glyph, rendered size, weight, colour and alignment match while path shapes may differ."
    ]
  },
  "accessibility": {
    "wcagTarget": "WCAG 2.2 AA",
    "auditStatus": "passed",
    "findings": []
  },
  "source": {
    "commit": "d1511e224305585680723101a0b76be93eb9f2f0",
    "verifiedAt": "2026-07-28",
    "files": [
      {
        "path": "src/app/components/ui/input-otp.tsx",
        "sha256": "b15b03f71841b176baa6e0294a0790eea1ffe9264c55003fbbc9039d8457057b"
      }
    ],
    "decisionReferences": [
      "provenance/decisions.md#component-scope",
      "foundations/docs/exceptions.md"
    ]
  }
}
