{
  "$schema": "../component.schema.json",
  "schemaVersion": "1.0.0",
  "id": "form",
  "title": "Form",
  "description": "Framework-native form composition and validation messaging.",
  "category": "forms",
  "maturity": "beta",
  "searchTerms": [
    "form",
    "validation",
    "field",
    "react",
    "blade"
  ],
  "react": {
    "files": [
      "react/components/ui/form.tsx"
    ],
    "exports": [
      "Form",
      "FormField",
      "FormItem",
      "FormLabel",
      "FormControl",
      "FormDescription",
      "FormMessage",
      "useFormField"
    ],
    "props": [
      {
        "name": "control",
        "type": "react-hook-form Control",
        "required": true
      },
      {
        "name": "name",
        "type": "FieldPath",
        "required": true
      },
      {
        "name": "className",
        "type": "string",
        "required": false,
        "description": "Additional consumer layout or spacing classes."
      }
    ],
    "internalDependencies": [
      "label"
    ],
    "npmDependencies": [
      {
        "name": "@radix-ui/react-label",
        "version": "2.1.2",
        "purpose": "Direct component import"
      },
      {
        "name": "@radix-ui/react-slot",
        "version": "1.1.2",
        "purpose": "Direct component import"
      },
      {
        "name": "react-hook-form",
        "version": "7.55.0",
        "purpose": "Direct component import"
      }
    ],
    "exampleFiles": [
      "react/examples/form/basic.tsx"
    ]
  },
  "blade": {
    "files": [
      "blade/library/resources/views/components/ui/form.blade.php",
      "blade/library/resources/views/components/ui/form/control.blade.php",
      "blade/library/resources/views/components/ui/form/description.blade.php",
      "blade/library/resources/views/components/ui/form/item.blade.php",
      "blade/library/resources/views/components/ui/form/label.blade.php",
      "blade/library/resources/views/components/ui/form/message.blade.php"
    ],
    "canonicalTag": "<x-ui.form>",
    "legacyTags": [],
    "props": [
      {
        "name": "action",
        "type": "string",
        "required": false,
        "default": ""
      },
      {
        "name": "method",
        "type": "string",
        "required": false,
        "default": "get"
      },
      {
        "name": "upload",
        "type": "bool",
        "required": false,
        "default": false
      }
    ],
    "slots": [
      "default"
    ],
    "events": [],
    "phpDependencies": [
      "App\\View\\Components\\Ui\\FormControl"
    ],
    "runtimeDependencies": [],
    "installTargets": [
      "app/View/Components/Ui",
      "resources/views/components/ui",
      "resources/js/ui",
      "resources/css"
    ],
    "exampleFiles": [
      "blade/examples/form/basic.blade.php"
    ]
  },
  "shared": {
    "variants": [
      {
        "name": "default",
        "default": true
      }
    ],
    "sizes": [],
    "states": [
      "default",
      "disabled",
      "focus-visible",
      "invalid"
    ],
    "responsiveBehavior": [
      "Retains touch targets and usable wrapping at 360px."
    ],
    "tokens": [
      "--background",
      "--foreground",
      "--primary",
      "--primary-foreground",
      "--muted",
      "--muted-foreground",
      "--border",
      "--input",
      "--ring",
      "--radius"
    ],
    "iconMappings": []
  },
  "previews": [
    {
      "id": "basic",
      "title": "Basic",
      "reactExample": "react/examples/form/basic.tsx",
      "bladeExample": "blade/examples/form/basic.blade.php",
      "states": [
        "default",
        "disabled",
        "focus-visible",
        "invalid"
      ],
      "supportsDirection": false
    }
  ],
  "parity": {
    "classification": "documented-exception",
    "intentionalDifferences": [
      "React validation is client-controlled through react-hook-form; Blade preserves CSRF, method spoofing, old values, named error bags and server validation."
    ]
  },
  "accessibility": {
    "wcagTarget": "WCAG 2.2 AA",
    "auditStatus": "passed",
    "findings": []
  },
  "source": {
    "commit": "d1511e224305585680723101a0b76be93eb9f2f0",
    "verifiedAt": "2026-07-28",
    "files": [
      {
        "path": "src/app/components/ui/form.tsx",
        "sha256": "b181a640358bd91b827f7e3ba610036f24a976994d4d88b480471a167770a508"
      }
    ],
    "decisionReferences": [
      "provenance/decisions.md#component-scope",
      "foundations/docs/exceptions.md"
    ]
  }
}
