{
  "$schema": "../component.schema.json",
  "schemaVersion": "1.0.0",
  "id": "scroll-area",
  "title": "Scroll Area",
  "description": "Styled overflow region with optional scrollbars.",
  "category": "layout",
  "maturity": "stable",
  "searchTerms": [
    "scroll area",
    "overflow",
    "viewport",
    "react",
    "blade"
  ],
  "react": {
    "files": [
      "react/components/ui/scroll-area.tsx"
    ],
    "exports": [
      "ScrollArea",
      "ScrollBar"
    ],
    "props": [
      {
        "name": "type",
        "type": "\"auto\" | \"always\" | \"scroll\" | \"hover\"",
        "required": false,
        "default": "hover"
      },
      {
        "name": "className",
        "type": "string",
        "required": false,
        "description": "Additional consumer layout or spacing classes."
      }
    ],
    "internalDependencies": [],
    "npmDependencies": [
      {
        "name": "@radix-ui/react-scroll-area",
        "version": "1.2.3",
        "purpose": "Direct component import"
      }
    ],
    "exampleFiles": [
      "react/examples/scroll-area/basic.tsx"
    ]
  },
  "blade": {
    "files": [
      "blade/library/resources/views/components/ui/scroll-area.blade.php",
      "blade/library/resources/views/components/ui/scroll-area/bar.blade.php"
    ],
    "canonicalTag": "<x-ui.scroll-area>",
    "legacyTags": [],
    "props": [
      {
        "name": "orientation",
        "type": "\"vertical\" | \"horizontal\" | \"both\"",
        "required": false,
        "default": "vertical"
      }
    ],
    "slots": [
      "default"
    ],
    "events": [],
    "phpDependencies": [],
    "runtimeDependencies": [],
    "installTargets": [
      "app/View/Components/Ui",
      "resources/views/components/ui",
      "resources/js/ui",
      "resources/css"
    ],
    "exampleFiles": [
      "blade/examples/scroll-area/basic.blade.php"
    ]
  },
  "shared": {
    "variants": [
      {
        "name": "default",
        "default": true
      }
    ],
    "sizes": [],
    "states": [
      "default",
      "disabled",
      "focus-visible"
    ],
    "responsiveBehavior": [
      "Retains touch targets and usable wrapping at 360px."
    ],
    "tokens": [
      "--background",
      "--foreground",
      "--primary",
      "--primary-foreground",
      "--muted",
      "--muted-foreground",
      "--border",
      "--input",
      "--ring",
      "--radius"
    ],
    "iconMappings": []
  },
  "previews": [
    {
      "id": "basic",
      "title": "Basic",
      "reactExample": "react/examples/scroll-area/basic.tsx",
      "bladeExample": "blade/examples/scroll-area/basic.blade.php",
      "states": [
        "default",
        "disabled",
        "focus-visible"
      ],
      "supportsDirection": false
    }
  ],
  "parity": {
    "classification": "documented-exception",
    "intentionalDifferences": [
      "Blade retains native overflow and scrollbar semantics; React delegates the viewport and scrollbar parts to Radix."
    ]
  },
  "accessibility": {
    "wcagTarget": "WCAG 2.2 AA",
    "auditStatus": "passed",
    "findings": []
  },
  "source": {
    "commit": "d1511e224305585680723101a0b76be93eb9f2f0",
    "verifiedAt": "2026-07-28",
    "files": [
      {
        "path": "src/app/components/ui/scroll-area.tsx",
        "sha256": "5bd9bb1d6909467b431283e96d2a9c83003bca1aa043d149dcfed8e81de51986"
      }
    ],
    "decisionReferences": [
      "provenance/decisions.md#component-scope",
      "foundations/docs/exceptions.md"
    ]
  }
}
