{
  "$schema": "../component.schema.json",
  "schemaVersion": "1.0.0",
  "id": "sheet",
  "title": "Sheet",
  "description": "Modal panel entering from any viewport edge.",
  "category": "overlays",
  "maturity": "stable",
  "searchTerms": [
    "sheet",
    "panel",
    "drawer",
    "react",
    "blade"
  ],
  "react": {
    "files": [
      "react/components/ui/sheet.tsx"
    ],
    "exports": [
      "Sheet",
      "SheetTrigger",
      "SheetClose",
      "SheetContent",
      "SheetHeader",
      "SheetFooter",
      "SheetTitle",
      "SheetDescription"
    ],
    "props": [
      {
        "name": "open",
        "type": "boolean",
        "required": false
      },
      {
        "name": "defaultOpen",
        "type": "boolean",
        "required": false,
        "default": false
      },
      {
        "name": "onOpenChange",
        "type": "(open: boolean) => void",
        "required": false
      },
      {
        "name": "side",
        "type": "\"top\" | \"right\" | \"bottom\" | \"left\"",
        "required": false,
        "default": "right"
      },
      {
        "name": "className",
        "type": "string",
        "required": false,
        "description": "Additional consumer layout or spacing classes."
      }
    ],
    "internalDependencies": [],
    "npmDependencies": [
      {
        "name": "@radix-ui/react-dialog",
        "version": "1.1.6",
        "purpose": "Direct component import"
      },
      {
        "name": "lucide-react",
        "version": "0.487.0",
        "purpose": "Direct component import"
      }
    ],
    "exampleFiles": [
      "react/examples/sheet/basic.tsx"
    ]
  },
  "blade": {
    "files": [
      "blade/library/resources/views/components/ui/sheet.blade.php",
      "blade/library/resources/views/components/ui/sheet/close.blade.php",
      "blade/library/resources/views/components/ui/sheet/content.blade.php",
      "blade/library/resources/views/components/ui/sheet/description.blade.php",
      "blade/library/resources/views/components/ui/sheet/footer.blade.php",
      "blade/library/resources/views/components/ui/sheet/header.blade.php",
      "blade/library/resources/views/components/ui/sheet/title.blade.php",
      "blade/library/resources/views/components/ui/sheet/trigger.blade.php"
    ],
    "canonicalTag": "<x-ui.sheet>",
    "legacyTags": [
      "<x-sidebar>",
      "<x-sidebar.toggle>"
    ],
    "props": [
      {
        "name": "side",
        "type": "\"top\" | \"right\" | \"bottom\" | \"left\"",
        "required": false,
        "default": "right"
      },
      {
        "name": "open",
        "type": "bool",
        "required": false,
        "default": false
      }
    ],
    "slots": [
      "default",
      "trigger",
      "header",
      "title",
      "description",
      "content",
      "footer"
    ],
    "events": [
      "ui:sheet:change"
    ],
    "phpDependencies": [],
    "runtimeDependencies": [
      {
        "name": "alpinejs",
        "version": "3.15.8",
        "purpose": "Blade interaction runtime"
      },
      {
        "name": "@alpinejs/focus",
        "version": "3.15.8",
        "purpose": "Blade interaction runtime"
      }
    ],
    "installTargets": [
      "app/View/Components/Ui",
      "resources/views/components/ui",
      "resources/js/ui",
      "resources/css"
    ],
    "exampleFiles": [
      "blade/examples/sheet/basic.blade.php"
    ]
  },
  "shared": {
    "variants": [
      {
        "name": "top",
        "default": true
      },
      {
        "name": "right"
      },
      {
        "name": "bottom"
      },
      {
        "name": "left"
      }
    ],
    "sizes": [],
    "states": [
      "default",
      "disabled",
      "focus-visible",
      "controlled",
      "uncontrolled",
      "open",
      "closed"
    ],
    "responsiveBehavior": [
      "Retains touch targets and usable wrapping at 360px.",
      "Floating or modal content is constrained to the viewport."
    ],
    "tokens": [
      "--background",
      "--foreground",
      "--primary",
      "--primary-foreground",
      "--muted",
      "--muted-foreground",
      "--border",
      "--input",
      "--ring",
      "--radius"
    ],
    "iconMappings": [
      {
        "meaning": "close",
        "react": "X",
        "blade": "x",
        "size": "16px",
        "weight": "regular"
      }
    ]
  },
  "previews": [
    {
      "id": "basic",
      "title": "Basic",
      "reactExample": "react/examples/sheet/basic.tsx",
      "bladeExample": "blade/examples/sheet/basic.blade.php",
      "states": [
        "default",
        "disabled",
        "focus-visible",
        "controlled",
        "uncontrolled",
        "open",
        "closed"
      ],
      "supportsDirection": true
    }
  ],
  "parity": {
    "classification": "framework-equivalent",
    "intentionalDifferences": [
      "React uses Lucide and Blade uses Phosphor; semantic glyph, rendered size, weight, colour and alignment match while path shapes may differ."
    ]
  },
  "accessibility": {
    "wcagTarget": "WCAG 2.2 AA",
    "auditStatus": "passed",
    "findings": []
  },
  "source": {
    "commit": "d1511e224305585680723101a0b76be93eb9f2f0",
    "verifiedAt": "2026-07-28",
    "files": [
      {
        "path": "src/app/components/ui/sheet.tsx",
        "sha256": "877cc293bc6106533d71a9fc59890bf6fbfa787e1377f8cf999d0488db01a4cc"
      }
    ],
    "decisionReferences": [
      "provenance/decisions.md#component-scope"
    ]
  }
}
